{
  "extraction_schema_version": "0.1",
  "extraction_id": "FIX-RAW-001",
  "extracted_at_utc": "2026-09-25T18:30:00Z",
  "source": {
    "primary_artifact_id": "ART-FIX-001",
    "artifacts": [
      {
        "artifact_id": "ART-FIX-001",
        "artifact_type": "screenshot",
        "content_hash": {
          "algorithm": "sha256",
          "value": "fixture-hash-001"
        }
      }
    ]
  },
  "members": [
    {
      "source_member_key": "ROW-001",
      "source_identity": {
        "status": "OBSERVED",
        "source_system": "FIXTURE",
        "source_identity_id": "raw-001"
      },
      "fields": {
        "rank": {
          "status": "OBSERVED",
          "raw_value": "1",
          "interpretation": "NONE",
          "evidence_refs": [
            "ART-FIX-001"
          ]
        },
        "display_name": {
          "status": "OBSERVED",
          "raw_value": "Player A",
          "interpretation": "NONE",
          "evidence_refs": [
            "ART-FIX-001"
          ]
        },
        "stage": {
          "status": "OBSERVED",
          "raw_value": "10",
          "interpretation": "NONE",
          "evidence_refs": [
            "ART-FIX-001"
          ]
        },
        "weapons": {
          "status": "OBSERVED",
          "raw_value": {
            "25mm": "4",
            "hydra": "3"
          },
          "interpretation": "NONE",
          "evidence_refs": [
            "ART-FIX-001"
          ]
        },
        "total_kills": {
          "status": "OBSERVED",
          "raw_value": "10000",
          "interpretation": "NONE",
          "evidence_refs": [
            "ART-FIX-001"
          ]
        },
        "lifetime_medals": {
          "status": "OBSERVED",
          "raw_value": {
            "bronze": "2"
          },
          "interpretation": "NONE",
          "evidence_refs": [
            "ART-FIX-001"
          ]
        },
        "current_league_clan_medals": {
          "status": "OBSERVED",
          "raw_value": "100",
          "interpretation": "NONE",
          "evidence_refs": [
            "ART-FIX-001"
          ]
        },
        "profile_total_clan_medal_count": {
          "status": "OBSERVED",
          "raw_value": "100",
          "interpretation": "NONE",
          "evidence_refs": [
            "ART-FIX-001"
          ]
        }
      },
      "evidence_refs": [
        "ART-FIX-001"
      ]
    }
  ]
}
